{
  "$schema": "../../schemas/preset-unified.schema.json",
  "id": "europe-unified-default",
  "name": "EU - Vue unifiée standard",
  "description": "Projection Natural Earth centrée sur l'Europe",
  "atlasId": "europe",
  "type": "unified",
  "config": {
    "projection": {
      "id": "natural-earth",
      "parameters": {
        "center": [10, 52],
        "scale": 1.0
      }
    }
  }
}
